202,"Козаки, повертаючись з посольства, перетворюють бідного пастушка на вродливого нареченого для багатої дочки. Коли обман розкривається, кохання перемагає, а козаки з усмішкою їдуть далі."
201,"Таємнича сила викрадає людей. Незнайомці об'єднуються, щоб її зупинити. Кожен з них має таємниці, які можуть зруйнувати довіру. Лише правда може врятувати їх, допомогти знайти шлях до свободи."
176,"Осінь настала, і маленька мишка повинна впасти в сплячку, але вона не може заснути. Ніякі поради та вправи не допомагали. Рахування овечок і навіть допомога друзів не принесли бажаного результату."
175,"Гарбузик вирішив не бути просто овочем на кухні і мріяв про різні професії. Він приміряє на себе різні професії, в пошуках того, що йому підійде найкраще."
158,"Марійк підросла і почала ходити в садок, де знайшла друга. Одного дня, коли осінь настала, до Марійка засмутилася та заплакала. Проте її новий друг зумів її розрадити."
129,"Юнак, розбещений багатством батька, не цінував грошей, доки не змушений був заробити сам. Після тяжкої праці він зрозумів їхню справжню ціну та став гідним спадкоємцем родинного господарства."
110,"Дівчинка мріє про казку. Вона вчить свою улюблену ляльку бути справжньою принцесою, розкриваючи секрети краси, охайності та добрих манер. Але найголовніше диво ще попереду."